{
  "zml_version": "1.0.0",
  "id": "fr_caf_droits",
  "version": "2026-07-28",
  "display_name": {
    "en": "Caf Droits",
    "he": "קצבאות (צרפת) · זכויות"
  },
  "market": "FR",
  "category": "consumer_protection",
  "predicate": {
    "operator": "OR",
    "conditions": [
      {
        "operator": "AND",
        "conditions": [
          {
            "field": "dependents",
            "operator": "gte",
            "value": 1,
            "source": "user_input"
          }
        ]
      },
      {
        "operator": "AND",
        "conditions": [
          {
            "field": "incomeBand",
            "operator": "in",
            "value": [
              "low"
            ],
            "source": "user_input"
          }
        ]
      }
    ]
  },
  "action": {
    "kind": "letter",
    "template_ref": "https://zakai-3uxj.vercel.app/api/rights/catalog/fr_caf_droits",
    "auto_eligible": false,
    "requires_human_gate": true,
    "output_format": "email"
  },
  "source": {
    "type": "guideline",
    "reference": "Code de la sécurité sociale — prestations CAF"
  },
  "metadata": {
    "maintainer": "yyrhlbrstt@gmail.com",
    "last_verified": "2026-07-28",
    "confidence": "high",
    "evaluation_engine": "zakai_predicate_v1"
  }
}
