{
  "zml_version": "1.0.0",
  "id": "pl_stypendium",
  "version": "2026-08-02",
  "display_name": {
    "en": "Stypendium",
    "he": "מלגה"
  },
  "market": "PL",
  "category": "education",
  "predicate": {
    "operator": "AND",
    "conditions": [
      {
        "field": "employment",
        "operator": "in",
        "value": [
          "student"
        ],
        "source": "user_input"
      }
    ]
  },
  "action": {
    "kind": "letter",
    "template_ref": "https://zakai-3uxj.vercel.app/api/rights/catalog/pl_stypendium",
    "auto_eligible": false,
    "requires_human_gate": true,
    "output_format": "email"
  },
  "source": {
    "type": "guideline",
    "reference": "Ustawa z dnia 20 lipca 2018 r. — studia i stypendia"
  },
  "metadata": {
    "maintainer": "yyrhlbrstt@gmail.com",
    "last_verified": "2026-08-02",
    "confidence": "high",
    "evaluation_engine": "zakai_predicate_v1"
  }
}
