{
  "zml_version": "1.0.0",
  "id": "au_super_guarantee_shortfall",
  "version": "2026-07-30",
  "display_name": {
    "en": "Super Guarantee Shortfall",
    "he": "פנסיה (אוסטרליה) · ערבות · חוסר"
  },
  "market": "AU",
  "category": "employment",
  "predicate": {
    "operator": "AND",
    "conditions": [
      {
        "field": "employment",
        "operator": "in",
        "value": [
          "employee"
        ],
        "source": "user_input"
      }
    ]
  },
  "action": {
    "kind": "letter",
    "template_ref": "https://zakai-3uxj.vercel.app/api/rights/catalog/au_super_guarantee_shortfall",
    "auto_eligible": false,
    "requires_human_gate": true,
    "output_format": "email"
  },
  "source": {
    "type": "statute",
    "reference": "Superannuation Guarantee (Administration) Act 1992 (Cth)"
  },
  "metadata": {
    "maintainer": "yyrhlbrstt@gmail.com",
    "last_verified": "2026-07-30",
    "confidence": "high",
    "evaluation_engine": "zakai_predicate_v1"
  }
}
