{
  "zml_version": "1.0.0",
  "id": "il_heating_grant",
  "version": "2026-07-26",
  "display_name": {
    "en": "heating grant",
    "he": "heating grant"
  },
  "market": "IL",
  "category": "health",
  "predicate": {
    "operator": "AND",
    "conditions": [
      {
        "operator": "OR",
        "conditions": [
          {
            "operator": "AND",
            "conditions": [
              {
                "field": "ageYears",
                "operator": "gte",
                "value": 67,
                "source": "user_input"
              }
            ]
          },
          {
            "operator": "AND",
            "conditions": [
              {
                "field": "employment",
                "operator": "in",
                "value": [
                  "retired"
                ],
                "source": "user_input"
              }
            ]
          }
        ]
      },
      {
        "operator": "AND",
        "conditions": [
          {
            "field": "incomeBand",
            "operator": "in",
            "value": [
              "low"
            ],
            "source": "user_input"
          }
        ]
      }
    ]
  },
  "action": {
    "kind": "letter",
    "template_ref": "https://zakai-3uxj.vercel.app/api/rights/catalog/il_heating_grant",
    "auto_eligible": false,
    "requires_human_gate": true,
    "output_format": "email"
  },
  "source": {
    "type": "statute",
    "reference": "חוק הביטוח הלאומי — מענק חימום לזכאי השלמת הכנסה"
  },
  "metadata": {
    "maintainer": "yyrhlbrstt@gmail.com",
    "last_verified": "2026-07-26",
    "confidence": "high",
    "evaluation_engine": "zakai_predicate_v1"
  }
}
