{
  "zml_version": "1.0.0",
  "id": "es_comisiones_banco",
  "version": "2026-08-02",
  "display_name": {
    "en": "Comisiones Banco",
    "he": "עמלות בנק"
  },
  "market": "ES",
  "category": "finance",
  "predicate": {
    "operator": "AND",
    "conditions": []
  },
  "action": {
    "kind": "letter",
    "template_ref": "https://zakai-3uxj.vercel.app/api/rights/catalog/es_comisiones_banco",
    "auto_eligible": false,
    "requires_human_gate": true,
    "output_format": "email"
  },
  "source": {
    "type": "guideline",
    "reference": "Ley 7/1998 — transparencia y comisiones bancarias"
  },
  "metadata": {
    "maintainer": "yyrhlbrstt@gmail.com",
    "last_verified": "2026-08-02",
    "confidence": "high",
    "evaluation_engine": "zakai_predicate_v1"
  }
}
