{
  "zml_version": "1.0.0",
  "id": "de_elterngeld_check",
  "version": "2026-07-28",
  "display_name": {
    "en": "Elterngeld Check",
    "he": "דמי הורות · בדיקה"
  },
  "market": "DE",
  "category": "consumer_protection",
  "predicate": {
    "operator": "AND",
    "conditions": [
      {
        "field": "dependents",
        "operator": "gte",
        "value": 1,
        "source": "user_input"
      }
    ]
  },
  "action": {
    "kind": "letter",
    "template_ref": "https://zakai-3uxj.vercel.app/api/rights/catalog/de_elterngeld_check",
    "auto_eligible": false,
    "requires_human_gate": true,
    "output_format": "email"
  },
  "source": {
    "type": "guideline",
    "reference": "BEEG — Elterngeld"
  },
  "metadata": {
    "maintainer": "yyrhlbrstt@gmail.com",
    "last_verified": "2026-07-28",
    "confidence": "high",
    "evaluation_engine": "zakai_predicate_v1"
  }
}
