{
  "zml_version": "1.0.0",
  "id": "us_overdraft_fee_review",
  "version": "2026-08-03",
  "display_name": {
    "en": "Overdraft Fee Review",
    "he": "מינוס · עמלה · בדיקה"
  },
  "market": "US",
  "category": "finance",
  "predicate": {
    "operator": "AND",
    "conditions": []
  },
  "action": {
    "kind": "letter",
    "template_ref": "https://zakai-3uxj.vercel.app/api/rights/catalog/us_overdraft_fee_review",
    "auto_eligible": false,
    "requires_human_gate": true,
    "output_format": "email"
  },
  "source": {
    "type": "regulation",
    "reference": "CFPB overdraft rulemaking; Regulation E; state unfair-practices statutes"
  },
  "metadata": {
    "maintainer": "yyrhlbrstt@gmail.com",
    "last_verified": "2026-08-03",
    "confidence": "high",
    "evaluation_engine": "zakai_predicate_v1"
  }
}
