{
  "zml_version": "1.0.0",
  "id": "pl_lot",
  "version": "2026-08-02",
  "display_name": {
    "en": "Flight compensation (EU261)",
    "he": "פיצוי טיסה (EU261)"
  },
  "market": "PL",
  "category": "consumer_protection",
  "predicate": {
    "operator": "AND",
    "conditions": []
  },
  "action": {
    "kind": "calculation",
    "internal_tool": "/flights",
    "auto_eligible": false,
    "requires_human_gate": true,
    "output_format": "json"
  },
  "source": {
    "type": "guideline",
    "reference": "Rozporządzenie (WE) nr 261/2004"
  },
  "metadata": {
    "maintainer": "yyrhlbrstt@gmail.com",
    "last_verified": "2026-08-02",
    "confidence": "high",
    "evaluation_engine": "zakai_predicate_v1"
  }
}
