{
  "zml_version": "1.0.0",
  "id": "gb_tax_free_childcare",
  "version": "2026-08-02",
  "display_name": {
    "en": "Tax Free Childcare",
    "he": "מס · חינם · מעון"
  },
  "market": "GB",
  "category": "consumer_protection",
  "predicate": {
    "operator": "AND",
    "conditions": [
      {
        "operator": "AND",
        "conditions": [
          {
            "field": "dependentsUnder6",
            "operator": "gte",
            "value": 1,
            "source": "user_input"
          }
        ]
      },
      {
        "operator": "AND",
        "conditions": [
          {
            "field": "employment",
            "operator": "in",
            "value": [
              "employee",
              "self_employed"
            ],
            "source": "user_input"
          }
        ]
      }
    ]
  },
  "action": {
    "kind": "letter",
    "template_ref": "https://zakai-3uxj.vercel.app/api/rights/catalog/gb_tax_free_childcare",
    "auto_eligible": false,
    "requires_human_gate": true,
    "output_format": "email"
  },
  "source": {
    "type": "statute",
    "reference": "Childcare Payments Act 2014"
  },
  "metadata": {
    "maintainer": "yyrhlbrstt@gmail.com",
    "last_verified": "2026-08-02",
    "confidence": "high",
    "evaluation_engine": "zakai_predicate_v1"
  }
}
