{
  "zml_version": "1.0.0",
  "id": "de_kaution_rueckzahlung",
  "version": "2026-07-28",
  "display_name": {
    "en": "Kaution Rueckzahlung",
    "he": "פיקדון · החזר"
  },
  "market": "DE",
  "category": "housing",
  "predicate": {
    "operator": "AND",
    "conditions": [
      {
        "field": "housing",
        "operator": "in",
        "value": [
          "renting"
        ],
        "source": "user_input"
      }
    ]
  },
  "action": {
    "kind": "letter",
    "template_ref": "https://zakai-3uxj.vercel.app/api/rights/catalog/de_kaution_rueckzahlung",
    "auto_eligible": false,
    "requires_human_gate": true,
    "output_format": "email"
  },
  "source": {
    "type": "guideline",
    "reference": "BGB § 551 — Mietkaution"
  },
  "metadata": {
    "maintainer": "yyrhlbrstt@gmail.com",
    "last_verified": "2026-07-28",
    "confidence": "high",
    "evaluation_engine": "zakai_predicate_v1"
  }
}
