{
  "zml_version": "1.0.0",
  "id": "il_old_age_pension",
  "version": "2026-07-26",
  "display_name": {
    "en": "old age pension",
    "he": "old age pension"
  },
  "market": "IL",
  "category": "health",
  "predicate": {
    "operator": "OR",
    "conditions": [
      {
        "operator": "AND",
        "conditions": [
          {
            "field": "ageYears",
            "operator": "gte",
            "value": 67,
            "source": "user_input"
          }
        ]
      },
      {
        "operator": "AND",
        "conditions": [
          {
            "field": "employment",
            "operator": "in",
            "value": [
              "retired"
            ],
            "source": "user_input"
          }
        ]
      }
    ]
  },
  "action": {
    "kind": "letter",
    "template_ref": "https://zakai-3uxj.vercel.app/api/rights/catalog/il_old_age_pension",
    "auto_eligible": false,
    "requires_human_gate": true,
    "output_format": "email"
  },
  "source": {
    "type": "statute",
    "reference": "חוק הביטוח הלאומי, פרק י״א"
  },
  "metadata": {
    "maintainer": "yyrhlbrstt@gmail.com",
    "last_verified": "2026-07-26",
    "confidence": "high",
    "evaluation_engine": "zakai_predicate_v1"
  }
}
