{
  "zml_version": "1.0.0",
  "id": "gb_free_childcare_hours",
  "version": "2026-08-03",
  "display_name": {
    "en": "Free Childcare Hours",
    "he": "חינם · מעון · שעות"
  },
  "market": "GB",
  "category": "consumer_protection",
  "predicate": {
    "operator": "AND",
    "conditions": [
      {
        "operator": "AND",
        "conditions": [
          {
            "field": "dependentsUnder6",
            "operator": "gte",
            "value": 1,
            "source": "user_input"
          }
        ]
      },
      {
        "operator": "AND",
        "conditions": [
          {
            "field": "employment",
            "operator": "in",
            "value": [
              "employee",
              "self_employed"
            ],
            "source": "user_input"
          }
        ]
      }
    ]
  },
  "action": {
    "kind": "letter",
    "template_ref": "https://zakai-3uxj.vercel.app/api/rights/catalog/gb_free_childcare_hours",
    "auto_eligible": false,
    "requires_human_gate": true,
    "output_format": "email"
  },
  "source": {
    "type": "regulation",
    "reference": "Childcare Act 2016 and the Childcare (Free of Charge for Working Parents) Regulations"
  },
  "metadata": {
    "maintainer": "yyrhlbrstt@gmail.com",
    "last_verified": "2026-08-03",
    "confidence": "high",
    "evaluation_engine": "zakai_predicate_v1"
  }
}
