{
  "zml_version": "1.0.0",
  "id": "se_prenumerationer",
  "version": "2026-08-02",
  "display_name": {
    "en": "Cancel subscription",
    "he": "ביטול מנוי"
  },
  "market": "SE",
  "category": "consumer_protection",
  "predicate": {
    "operator": "AND",
    "conditions": []
  },
  "action": {
    "kind": "calculation",
    "internal_tool": "/cancel",
    "auto_eligible": false,
    "requires_human_gate": true,
    "output_format": "json"
  },
  "source": {
    "type": "guideline",
    "reference": "Distansavtalslagen — uppsägning"
  },
  "metadata": {
    "maintainer": "yyrhlbrstt@gmail.com",
    "last_verified": "2026-08-02",
    "confidence": "high",
    "evaluation_engine": "zakai_predicate_v1"
  }
}
