{
  "zml_version": "1.0.0",
  "id": "au_consumer_guarantee_remedy",
  "version": "2026-07-30",
  "display_name": {
    "en": "Consumer Guarantee Remedy",
    "he": "צרכן · ערבות · תרופה"
  },
  "market": "AU",
  "category": "consumer_protection",
  "predicate": {
    "operator": "AND",
    "conditions": []
  },
  "action": {
    "kind": "letter",
    "template_ref": "https://zakai-3uxj.vercel.app/api/rights/catalog/au_consumer_guarantee_remedy",
    "auto_eligible": false,
    "requires_human_gate": true,
    "output_format": "email"
  },
  "source": {
    "type": "statute",
    "reference": "Australian Consumer Law (Schedule 2, Competition and Consumer Act 2010 (Cth)), s. 54"
  },
  "metadata": {
    "maintainer": "yyrhlbrstt@gmail.com",
    "last_verified": "2026-07-30",
    "confidence": "high",
    "evaluation_engine": "zakai_predicate_v1"
  }
}
