{
  "zml_version": "1.0.0",
  "id": "il_consumer_telecom_exit",
  "version": "2026-07-26",
  "display_name": {
    "en": "consumer telecom exit",
    "he": "consumer telecom exit"
  },
  "market": "IL",
  "category": "consumer_protection",
  "predicate": {
    "operator": "AND",
    "conditions": []
  },
  "action": {
    "kind": "letter",
    "template_ref": "https://zakai-3uxj.vercel.app/api/rights/catalog/il_consumer_telecom_exit",
    "auto_eligible": false,
    "requires_human_gate": true,
    "output_format": "email"
  },
  "source": {
    "type": "statute",
    "reference": "חוק התקשורת (בזק ושידורים), התשמ״ב-1982, סעיף 13ג"
  },
  "metadata": {
    "maintainer": "yyrhlbrstt@gmail.com",
    "last_verified": "2026-07-26",
    "confidence": "high",
    "evaluation_engine": "zakai_predicate_v1"
  }
}
