{
  "zml_version": "1.0.0",
  "id": "il_hishtalmut_withdrawal",
  "version": "2026-07-26",
  "display_name": {
    "en": "hishtalmut withdrawal",
    "he": "hishtalmut withdrawal"
  },
  "market": "IL",
  "category": "finance",
  "predicate": {
    "operator": "AND",
    "conditions": [
      {
        "field": "employment",
        "operator": "in",
        "value": [
          "employee",
          "self_employed"
        ],
        "source": "user_input"
      }
    ]
  },
  "action": {
    "kind": "letter",
    "template_ref": "https://zakai-3uxj.vercel.app/api/rights/catalog/il_hishtalmut_withdrawal",
    "auto_eligible": false,
    "requires_human_gate": true,
    "output_format": "email"
  },
  "source": {
    "type": "guideline",
    "reference": "פקודת מס הכנסה — כללי מס הכנסה (כללים לאישור ולניהול קופות גמל)"
  },
  "metadata": {
    "maintainer": "il-maintainer@zakai.io",
    "last_verified": "2026-07-26",
    "confidence": "high",
    "evaluation_engine": "zakai_predicate_v1"
  }
}
