{
  "zml_version": "1.0.0",
  "id": "il_miluim_pay",
  "version": "2026-07-26",
  "display_name": {
    "en": "Reserve-duty pay & grants",
    "he": "תגמולי מילואים ומענקים"
  },
  "market": "IL",
  "category": "health",
  "predicate": {
    "operator": "AND",
    "conditions": [
      {
        "field": "militaryReserve",
        "operator": "eq",
        "value": true,
        "source": "user_input"
      }
    ]
  },
  "action": {
    "kind": "calculation",
    "internal_tool": "/miluim",
    "auto_eligible": false,
    "requires_human_gate": true,
    "output_format": "json"
  },
  "source": {
    "type": "statute",
    "reference": "חוק הביטוח הלאומי, פרק י״ב"
  },
  "metadata": {
    "maintainer": "yyrhlbrstt@gmail.com",
    "last_verified": "2026-07-26",
    "confidence": "high",
    "evaluation_engine": "zakai_predicate_v1"
  }
}
